{
  "$schema": "../../schema/character.schema.json",
  "id": "aelindra",
  "name": "Aelindra",
  "level": 3,
  "speciesId": "elf",
  "speciesChoices": {
    "lineageId": "high-elf",
    "keenSensesSkillId": "perception"
  },
  "backgroundId": "acolyte",
  "classId": "cleric",
  "subclassId": "life",
  "classChoices": {
    "divineOrder": "thaumaturge",
    "skillIds": ["medicine", "persuasion"]
  },
  "alignmentId": "neutral-good",
  "abilityGeneration": {
    "methodId": "standard-array",
    "backgroundBoostId": "two-and-one"
  },
  "languageIds": ["common", "elvish", "celestial"],
  "abilities": {
    "forca": 10,
    "destreza": 14,
    "constituicao": 13,
    "inteligencia": 10,
    "sabedoria": 16,
    "carisma": 8
  },
  "skillProficiencies": [
    { "skillId": "insight", "source": "background" },
    { "skillId": "religion", "source": "background" },
    { "skillId": "medicine", "source": "class" },
    { "skillId": "persuasion", "source": "class" },
    { "skillId": "perception", "source": "species" }
  ],
  "savingThrowProficiencies": ["sabedoria", "carisma"],
  "feats": [
    {
      "featId": "magic-initiate",
      "source": "background",
      "magicInitiate": {
        "spellListClassId": "cleric",
        "cantripIds": ["luz", "resistencia"],
        "preparedSpellId": "escudo-da-fe",
        "castingAbilityId": "sabedoria"
      }
    }
  ],
  "spellcasting": {
    "cantrips": {
      "class": ["chama-sagrada", "orientacao", "taumaturgia", "palavra-de-radiancia"],
      "magic-initiate": ["luz", "resistencia"],
      "elf-lineage": ["prestidigitacao-arcana"]
    },
    "prepared": {
      "class": [
        "comando",
        "detectar-o-bem-e-o-mal",
        "heroismo",
        "raio-guia",
        "silencio",
        "arma-espiritual"
      ],
      "magic-initiate": ["escudo-da-fe"],
      "life-domain": ["auxilio", "bencao", "curar-ferimentos", "restauracao-menor"],
      "elf-lineage": ["detectar-magia"]
    },
    "slotsMax": { "1": 4, "2": 2 },
    "slotsUsed": { "1": 0, "2": 0 }
  },
  "startingPackages": {
    "classOption": "A",
    "backgroundOption": "a"
  },
  "equipment": [
    { "itemId": "leather", "source": "class-starting", "equipped": true, "slot": "armor" },
    { "itemId": "shield", "source": "class-starting", "equipped": true, "slot": "shield" },
    { "itemId": "mace", "source": "class-starting", "equipped": true, "slot": "mainHand" },
    { "itemId": "kit-de-sacerdote", "source": "class-starting" },
    { "itemId": "simbolo-sagrado", "source": "class-starting", "equipped": true, "slot": "focus" },
    { "itemId": "suprimentos-de-caligrafo", "source": "background-starting" },
    { "itemId": "livro", "source": "background-starting" },
    { "itemId": "pergaminho", "source": "background-starting" },
    { "itemId": "tunica", "source": "background-starting" }
  ],
  "hp": { "current": 21, "max": 21, "temp": 0 },
  "resources": {
    "channelDivinity": { "max": 2, "remaining": 2 }
  },
  "notes": "Pacote A da classe + pacote A do antecedente Acólito. Símbolo Sagrado veio da classe (duplicata do antecedente omitida). 15 PO iniciais (7 + 8)."
}
